{
  "title": {
    "ar": "التصميم المعماري للبنايات التجارية",
    "en": "Architectural Design for Commercial Buildings",
    "fr": "Design Architectural pour Bâtiments Commerciaux"
  },
  "description": {
    "ar": "تصميم مكاتب ومتاجر وفضاءات تجارية عصرية",
    "en": "Designing modern offices, shops, and commercial spaces",
    "fr": "Conception de bureaux, boutiques et espaces commerciaux modernes"
  },
  "icon": "/assets/img/icons/service-2.svg",
  "order": 2,
  "comingSoon": false
}
