{
  "title": {
    "ar": "الريندر بالفوتوشوب",
    "en": "Photoshop Rendering",
    "fr": "Rendu Photoshop"
  },
  "description": {
    "ar": "إنتاج صور معمارية واقعية باستخدام الفوتوشوب",
    "en": "Creating realistic architectural images using Photoshop",
    "fr": "Création d'images architecturales réalistes avec Photoshop"
  },
  "icon": "/assets/img/icons/service-6.svg",
  "order": 6,
  "comingSoon": false
}
