{
  "title": {
    "ar": "تصميم الكتالوجات",
    "en": "Catalog Design",
    "fr": "Conception de Catalogues"
  },
  "description": {
    "ar": "تصميم كتالوجات منتجات وعروض تجارية جذابة",
    "en": "Design of attractive product and commercial catalogs",
    "fr": "Conception de catalogues de produits et commerciaux attrayants"
  },
  "icon": "/assets/img/icons/service-5.svg",
  "order": 5,
  "comingSoon": false
}
