{
  "title": {
    "ar": "الريندر ثلاثي الأبعاد",
    "en": "3D Architectural Rendering",
    "fr": "Rendu Architectural 3D"
  },
  "description": {
    "ar": "تصورات معمارية ثلاثية الأبعاد عالية الجودة (قريباً)",
    "en": "High-quality 3D architectural visualizations (Coming Soon)",
    "fr": "Visualisations architecturales 3D haute qualité (Bientôt)"
  },
  "icon": "/assets/img/icons/service-7.svg",
  "order": 7,
  "comingSoon": true
}
